ID;materialName;description;unit;unitPrice
22222222-2222-2222-2222-222222222001;Lithium-Ion Cell 18650;High capacity cylindrical cell;EA;3.75
22222222-2222-2222-2222-222222222002;Battery Management System;BMS board for 4S pack;EA;42.00
22222222-2222-2222-2222-222222222003;Nickel Strip 0.2mm;Pure nickel spot-welding strip (roll);ROLL;18.50
22222222-2222-2222-2222-222222222004;Heat Shrink Wrap;PVC insulation wrap for packs;MTR;0.90
22222222-2222-2222-2222-222222222005;Copper Busbar;Tinned copper bar for pack assembly;EA;6.25
